category,sub_category,english,definition_en,italian,pronunciation,singular_plural,tense,gender,commonness,part_of_speech,formal_informal,example_sentence_en,example_sentence_it,related_words_it,article_type,base_word
pronoun,subject,I,first-person singular subject pronoun,io,EE-oh,singular,,,1,pronoun,,I speak a little Italian.,Io parlo un po' di italiano.,me,,iare
pronoun,subject,you,second-person singular subject pronoun,tu,TOO,singular,,,1,pronoun,informal,You are very kind.,Tu sei molto gentile.,te,,tu
pronoun,subject,he,third-person masculine singular subject pronoun,lui,LOO-ee,singular,,masculine,1,pronoun,,He is at the hotel.,Lui è in hotel.,egli,,lui
pronoun,subject,she,third-person feminine singular subject pronoun,lei,LAY-ee,singular,,feminine,1,pronoun,,She likes coffee.,Lei ama il caffè.,ella,,lei
pronoun,subject,we,first-person plural subject pronoun,noi,NOY,plural,,,1,pronoun,,We are tourists.,Noi siamo turisti.,ci,,noi
pronoun,subject,you,second-person plural subject pronoun,voi,VOY,plural,,,1,pronoun,,You are friends.,Voi siete amici.,vi,,voi
pronoun,subject,they,third-person plural subject pronoun,loro,LOH-roh,plural,,,1,pronoun,,They are waiting outside.,Loro stanno aspettando fuori.,essi,,loro
